scene_title,topic_title,category,text,meaning,difficulty,description,examples_json
基础⑧·并列与转折,and 并列,并列连接,I like coffee and tea.,我喜欢咖啡和茶。,L1,and连接名词。,"[{""en"":""I like cats and dogs."",""zh"":""我喜欢猫和狗。""}]"
基础⑧·并列与转折,and 并列,并列连接,She is smart and kind.,她聪明又善良。,L1,and连接形容词。,"[{""en"":""He is tall and handsome."",""zh"":""他又高又帅。""}]"
基础⑧·并列与转折,and 并列,并列连接,I went to the store and bought some milk.,我去了商店买了些牛奶。,L1,and连接动词。,"[{""en"":""I sat down and read a book."",""zh"":""我坐下来看书。""}]"
基础⑧·并列与转折,or 选择,选择疑问,Do you want tea or coffee?,你想喝茶还是咖啡？,L1,or选择疑问句。,"[{""en"":""Do you want this or that?"",""zh"":""你要这个还是那个？""}]"
基础⑧·并列与转折,or 选择,选择疑问,Is it big or small?,它是大的还是小的？,L1,or选择问。,"[{""en"":""Is it hot or cold?"",""zh"":""是热还是冷？""}]"
基础⑧·并列与转折,but 转折,转折连接,I like him but he doesn't like me.,我喜欢他但他不喜欢我。,L1,but转折连接。,"[{""en"":""I want to go but I'm busy."",""zh"":""我想去但我很忙。""}]"
基础⑧·并列与转折,but 转折,转折对比,The food is cheap but it's delicious.,食物便宜但很好吃。,L1,but转折对比。,"[{""en"":""The hotel is small but clean."",""zh"":""酒店小但干净。""}]"
基础⑧·并列与转折,and 并列,原因表达,I stayed home because I was sick.,我待在家因为我病了。,L1,because原因从句。,"[{""en"":""I was late because I missed the bus."",""zh"":""我迟到了因为我错过了公交。""}]"
基础⑧·并列与转折,and 并列,原因表达,She is happy because she passed the test.,她开心因为她通过了考试。,L1,because原因从句。,"[{""en"":""He's tired because he worked all night."",""zh"":""他累了因为他工作了一整夜。""}]"
基础⑧·并列与转折,and 并列,原因前置,Because it rained we stayed inside.,因为下雨了我们待在里面。,L1,because句首。,"[{""en"":""Because I was tired I went to bed early."",""zh"":""因为我累了所以早早上床。""}]"
基础⑧·并列与转折,but 转折,结果表达,I was tired so I went to bed early.,我累了所以我早早上床了。,L1,so结果从句。,"[{""en"":""I was hungry so I ate."",""zh"":""我饿了所以吃了东西。""}]"
基础⑧·并列与转折,but 转折,结果表达,It started to rain so we took a taxi.,开始下雨了所以我们打了车。,L1,so结果从句。,"[{""en"":""The store was closed so I went home."",""zh"":""商店关门了所以我回家了。""}]"
基础⑧·并列与转折,however 对比,转折副词,I wanted to go However I was too busy.,我想去然而我太忙了。,L1,however句首转折。,"[{""en"":""I tried my best However I failed."",""zh"":""我尽力了然而我失败了。""}]"
基础⑧·并列与转折,not only...but also 递进,递进表达,She not only speaks English but also speaks Chinese.,她不仅说英语还说中文。,L1,not only...but also递进。,"[{""en"":""He not only sings but also dances."",""zh"":""他不仅唱歌还跳舞。""}]"
基础⑧·因果与条件,when 当…时,时间从句,When I arrived she was cooking.,我到的时候她正在做饭。,L1,when时间从句。,"[{""en"":""When I called he was sleeping."",""zh"":""我打电话时他在睡觉。""}]"
基础⑧·因果与条件,when 当…时,时间习惯,I always listen to music when I run.,我跑步时总是听音乐。,L1,when习惯表达。,"[{""en"":""I drink coffee when I wake up."",""zh"":""我醒来时喝咖啡。""}]"
基础⑧·因果与条件,when 当…时,时间将来,Call me when you get home.,你到家时给我打电话。,L1,when将来时间。,"[{""en"":""Text me when you arrive."",""zh"":""你到了给我发短信。""}]"
基础⑧·因果与条件,before/after 前后,时间先后,I brush my teeth before I go to bed.,我睡觉前刷牙。,L1,before时间从句。,"[{""en"":""I eat breakfast before I leave."",""zh"":""我离开前吃早餐。""}]"
基础⑧·因果与条件,before/after 前后,时间先后,After I finished work I went to the gym.,我下班后去了健身房。,L1,after时间从句。,"[{""en"":""After I woke up I took a shower."",""zh"":""我醒来后洗了澡。""}]"
基础⑧·因果与条件,while 同时,时间同时,We played games while we waited.,我们等的期间玩了游戏。,L1,while同时进行。,"[{""en"":""I listened to music while I worked."",""zh"":""我工作时听音乐。""}]"
基础⑧·因果与条件,until 直到,时间界限,Please wait here until I come back.,请在这里等到我回来。,L1,until时间界限。,"[{""en"":""Stay here until it stops raining."",""zh"":""待在这里直到雨停。""}]"
基础⑧·因果与条件,if 条件,条件从句,If it rains tomorrow I'll stay home.,如果明天下雨我就待在家。,L1,if条件句。,"[{""en"":""If I have time I'll call you."",""zh"":""如果我有时间我打给你。""}]"
基础⑧·因果与条件,if 条件,条件从句,If you study hard you will pass the test.,如果你努力学习你会通过考试的。,L1,if条件句。,"[{""en"":""If you practice every day you will get better."",""zh"":""如果你每天练习你会变得更好。""}]"
基础⑧·因果与条件,if 条件,祈使条件,Let me know if you need help.,如果你需要帮助就告诉我。,L1,if+祈使句。,"[{""en"":""Call me if you get lost."",""zh"":""如果你迷路了给我打电话。""}]"
基础⑧·因果与条件,unless 除非,条件从句,I won't go unless you come with me.,除非你跟我一起去否则我不去。,L1,unless条件句。,"[{""en"":""I won't eat unless I'm hungry."",""zh"":""除非我饿了我不会吃。""}]"
基础⑧·因果与条件,unless 除非,禁止条件,You can't enter unless you have a ticket.,除非你有票否则你不能进。,L1,unless禁止条件。,"[{""en"":""You can't drive unless you have a license."",""zh"":""除非你有驾照否则不能开车。""}]"
基础⑧·因果与条件,as long as 只要,虚拟建议,If I were you I would take the job.,如果我是你我就会接受那份工作。,L1,虚拟建议。,"[{""en"":""If I were you I would say sorry."",""zh"":""如果我是你我就会道歉。""}]"
基础⑧·因果与条件,as long as 只要,条件短语,As long as you try your best it's okay.,只要你尽力了就没关系。,L1,as long as条件。,"[{""en"":""As long as you're happy I'm happy."",""zh"":""只要你开心我就开心。""}]"
基础⑧·时间与顺序,for example 举例,举例表达,I like sports For example I play basketball.,我喜欢运动比如我打篮球。,L1,for example举例。,"[{""en"":""I like music For example I listen to pop."",""zh"":""我喜欢音乐比如我听流行。""}]"
基础⑧·时间与顺序,also/too/as well 补充,补充副词,She is kind Also she is very hardworking.,她很善良而且她非常勤奋。,L1,also补充。,"[{""en"":""He is smart Also he is funny."",""zh"":""他很聪明而且他很幽默。""}]"
基础⑧·时间与顺序,also/too/as well 补充,too句末,I like coffee He likes coffee too.,我喜欢咖啡他也喜欢咖啡。,L1,too句末补充。,"[{""en"":""I like tea He likes tea too."",""zh"":""我喜欢茶他也喜欢茶。""}]"
基础⑧·时间与顺序,also/too/as well 补充,as well补充,She speaks English and she speaks Japanese as well.,她说英语而且她也说日语。,L1,as well补充。,"[{""en"":""He can cook and he can bake as well."",""zh"":""他会做饭而且他也会烘焙。""}]"
基础⑧·时间与顺序,either 否定补充,否定补充,I don't like coffee I don't like tea either.,我不喜欢咖啡我也不喜欢茶。,L1,either否定补充。,"[{""en"":""I don't eat meat I don't eat fish either."",""zh"":""我不吃肉我也不吃鱼。""}]"
基础⑧·时间与顺序,besides/what's more 递进,what's more,It's a nice restaurant What's more the prices are good.,这家餐厅不错而且价格也实惠。,L1,what's more递进。,"[{""en"":""It's a good movie What's more it's free."",""zh"":""这是部好电影而且它是免费的。""}]"
基础⑧·时间与顺序,besides/what's more 递进,besides,I want to go but I have no time Besides I don't have money.,我想去但我没时间再说我也没钱。,L1,besides追加理由。,"[{""en"":""I want to travel but I'm busy Besides tickets are expensive."",""zh"":""我想旅行但我很忙再说票很贵。""}]"
基础⑧·时间与顺序,时间顺序链,顺序链,First I get up Then I take a shower After that I eat breakfast.,首先我起床然后我洗澡之后我吃早餐。,L1,时间顺序词。,"[{""en"":""First I do homework Then I watch TV After that I go to bed."",""zh"":""首先我做作业然后我看电视之后我上床。""}]"
基础⑧·时间与顺序,时间顺序链,顺序链,I went to the supermarket Next I went to the bank Finally I went home.,我去了超市接着去了银行最后回家了。,L1,next/finally顺序。,"[{""en"":""I went to the park Next I went to the library Finally I went home."",""zh"":""我去了公园接着去了图书馆最后回家了。""}]"
基础⑧·时间与顺序,时间顺序链,前后对比,At first I didn't like the job But later I started to enjoy it.,起初我不喜欢这工作但后来我开始喜欢了。,L1,at first...but later。,"[{""en"":""At first it was hard But later it became easy."",""zh"":""起初很难但后来变容易了。""}]"
基础⑧·时间与顺序,while 同时,过去同时,While I was cooking my sister was setting the table.,我在做饭的时候我妹妹在摆桌子。,L1,while过去进行。,"[{""en"":""While I was studying my roommate was sleeping."",""zh"":""我在学习的时候我室友在睡觉。""}]"
基础⑧·时间与顺序,before/after 前后,before提醒,Before you leave please turn off the lights.,在你离开之前请关灯。,L1,before提醒。,"[{""en"":""Before you go please lock the door."",""zh"":""在你走之前请锁门。""}]"
基础⑧·时间与顺序,before/after 前后,after后续,After you finish let me know Then we can go together.,你做完之后告诉我然后我们可以一起去。,L1,after...then。,"[{""en"":""After you arrive let me know Then we can meet."",""zh"":""你到了之后告诉我然后我们可以见面。""}]"
基础⑧·举例与补充,对话衔接词,well停顿,Well I think it's a good idea.,嗯我觉得这是个好主意。,L1,well表示犹豫。,"[{""en"":""Well I'm not sure."",""zh"":""嗯我不确定。""}]"
基础⑧·举例与补充,对话衔接词,actually纠正,Actually I don't like coffee I prefer tea.,其实我不喜欢咖啡我更喜欢茶。,L1,actually纠正补充。,"[{""en"":""Actually I changed my mind."",""zh"":""其实我改变主意了。""}]"
基础⑧·举例与补充,对话衔接词,by the way切换,By the way did you hear about the party?,顺便问一下你听说那个派对了吗？,L1,by the way切换话题。,"[{""en"":""By the way I saw your brother yesterday."",""zh"":""顺便说一下我昨天看到你哥哥了。""}]"
基础⑧·举例与补充,对话衔接词,anyway回到正题,Anyway let's get back to the topic.,不管怎样我们回到正题吧。,L1,anyway回到主题。,"[{""en"":""Anyway I have to go now."",""zh"":""不管怎样我现在得走了。""}]"
基础⑧·举例与补充,对话衔接词,I mean解释,I mean it's not that I don't want to go I'm just tired.,我是说不是我不想去我只是累了。,L1,I mean解释澄清。,"[{""en"":""I mean it's not that I don't like it I just need more time."",""zh"":""我是说不是我不喜欢我只是需要更多时间。""}]"
基础⑧·举例与补充,对话衔接词,let me see思考,Let me see I think the answer is B.,让我想想我觉得答案是B。,L1,let me see思考。,"[{""en"":""Let me see I think the answer is C."",""zh"":""让我想想我觉得答案是C。""}]"
基础⑧·举例与补充,对话衔接词,you know共鸣,You know I've always wanted to learn guitar.,你知道的我一直想学吉他。,L1,you know引起共鸣。,"[{""en"":""You know I've always wanted to travel."",""zh"":""你知道的我一直想旅行。""}]"
基础⑧·举例与补充,besides/what's more 递进,综合因果,I wanted to go out but it started to rain so I stayed home and watched a movie.,我想出去但开始下雨了所以我待在家看了电影。,L1,but→so→and综合。,"[{""en"":""I wanted to call you but you were busy so I texted you."",""zh"":""我想打给你但你很忙所以我给你发短信了。""}]"
基础⑧·举例与补充,if 条件,综合条件,If you're free this weekend we can go hiking But if it rains let's just stay in and play games.,如果你这周末有空我们可以去徒步但如果下雨我们就待在家玩游戏。,L1,if→but→if综合。,"[{""en"":""If you have time we can meet But if not let's talk tomorrow."",""zh"":""如果你有空我们可以见面但如果没有我们明天再聊。""}]"
基础⑧·举例与补充,because 原因,综合因果,When I got home I was really hungry because I didn't eat lunch.,我到家时特别饿因为没吃午饭。,L1,when→because综合。,"[{""en"":""When I saw her I was happy because she passed the test."",""zh"":""我看到她时特别开心因为她通过了考试。""}]"
基础⑧·举例与补充,and 并列,综合递进,She's very smart and she works hard so she always gets good grades.,她很聪明而且很努力所以总是考得好。,L1,and→so综合。,"[{""en"":""He's very kind and he helps others so everyone likes him."",""zh"":""他很善良而且帮助别人所以大家都喜欢他。""}]"
基础⑧·举例与补充,but 转折,混合逻辑,I like both coffee and tea but if I have to choose I prefer coffee because it helps me wake up.,咖啡茶我都喜欢但如果必须选我更喜欢咖啡因为它能让我清醒。,L1,混合逻辑表达。,"[{""en"":""I like both summer and winter but if I had to choose I prefer summer because it's warm."",""zh"":""夏天冬天我都喜欢但如果必须选我更喜欢夏天因为暖和。""}]"
基础⑧·举例与补充,时间顺序链,时间顺序综合,First we went to the museum After that we had lunch Then we walked in the park because the weather was nice.,我们先去了博物馆然后吃了午饭然后在公园散步因为天气很好。,L1,时间顺序+因果综合。,"[{""en"":""First we went shopping After that we ate dinner Then we went home because it was late."",""zh"":""我们先去购物然后吃了晚饭然后回家了因为天色已晚。""}]"
基础⑧·综合叙事,多步骤叙事,多步骤叙事,First I went to the store and bought some food Then I came home and cooked dinner After that I ate and watched TV.,先去商店买了食物然后回家做晚饭之后吃饭看电视。,L1,多步骤叙事。,"[{""en"":""First I went to the bank and cashed a check Then I went to the supermarket and bought groceries After that I went home and relaxed."",""zh"":""先去银行兑现支票然后去超市买杂货之后回家休息。""}]"
基础⑧·综合叙事,多步骤叙事,多步骤叙事,Before I go to work I always take a shower and eat breakfast After I get home I usually relax and read a book.,上班前总是洗澡吃早餐回家后通常放松看书。,L1,多步骤叙事。,"[{""en"":""Before I go to school I always check my bag and have breakfast After I come back I usually do homework and watch TV."",""zh"":""上学前总是检查书包吃早餐回家后通常做作业看电视。""}]"
基础⑧·综合叙事,因果链叙事,因果链叙事,I was late for work because I missed the bus so I had to take a taxi It was expensive but I had no choice.,上班迟到因为错过了公交所以打了车很贵但没办法。,L1,因果链叙事。,"[{""en"":""I missed the train because I woke up late so I took the next one It was crowded but I arrived on time."",""zh"":""错过了火车因为起晚了所以坐了下一趟很挤但准时到了。""}]"
基础⑧·综合叙事,因果链叙事,因果链叙事,She studied very hard because she wanted to pass the exam and she did it I'm so proud of her.,她努力学习因为想通过考试她做到了真为她骄傲。,L1,因果链叙事。,"[{""en"":""He practiced every day because he wanted to win the competition and he did it I'm so happy for him."",""zh"":""他每天练习因为想赢得比赛他做到了真为他高兴。""}]"
基础⑧·综合叙事,条件链叙事,时间+条件,When I got to the station the train had already left If I had left home earlier I wouldn't have missed it.,到车站时火车已经开了如果早点出门就不会错过。,L1,时间+条件叙事。,"[{""en"":""When I arrived at the store it had already closed If I had left earlier I wouldn't have missed it."",""zh"":""到商店时已经关门了如果早点出门就不会错过。""}]"
基础⑧·综合叙事,条件链叙事,观点+条件,I think this is a good idea because it's simple and easy to do If we try it we might get good results.,我觉得这是个好主意因为它简单易行如果试试可能会有好结果。,L1,观点+原因+条件。,"[{""en"":""I think this plan is great because it's cheap and fast If we start now we might finish today."",""zh"":""我觉得这个计划很棒因为它便宜又快捷如果现在开始可能今天就能完成。""}]"
基础⑧·综合叙事,混合观点表达,对比+转折,I like living in the city because it's convenient and exciting However it's also crowded and expensive.,我喜欢住在城市因为方便又刺激然而也很拥挤昂贵。,L1,对比+转折表达。,"[{""en"":""I like living in the suburbs because it's quiet and peaceful However it's also boring and far from work."",""zh"":""我喜欢住在郊区因为安静平和然而也很无聊且远离工作。""}]"
基础⑧·综合叙事,条件链叙事,条件+结果,As long as you study hard you'll do well But if you don't practice enough you might fall behind.,只要你努力学习就会表现好但如果不练习可能会落后。,L1,条件+转折表达。,"[{""en"":""As long as you save money you'll be fine But if you spend too much you might run out."",""zh"":""只要你存钱就会没问题但如果不节制可能会花光。""}]"
基础⑧·综合叙事,混合观点表达,建议链,I think you should take the job because it's a good opportunity Besides you can learn a lot of new things there.,我觉得你应该接受这份工作因为是个好机会而且能学到很多新东西。,L1,建议链表达。,"[{""en"":""I think you should study abroad because it's a great experience Besides you can make friends from all over the world."",""zh"":""我觉得你应该出国留学因为很棒的经历而且能交到世界各地的朋友。""}]"
基础⑧·综合叙事,混合观点表达,总结表达,In conclusion I believe that learning English is very important Not only can you talk to more people but you can also get a better job.,总之我认为学英语很重要不仅能和更多人交流还能找到更好的工作。,L1,总结递进表达。,"[{""en"":""In conclusion I believe that exercise is very important Not only can you stay healthy but you can also feel happier."",""zh"":""总之我认为运动很重要不仅能保持健康还能更快乐。""}]"
