scene_title,topic_title,category,text,meaning,difficulty,description,examples_json
雅思·IELTS Band 8.5 游刃有余,开怀大笑的经历,叙事开场,I've been thinking about this question, and one memory that immediately came to mind was this complete disaster of a road trip I took with my friends a few years back.,我一直在想这个问题，第一时间浮现的是几年前和朋友一次彻底搞砸的公路旅行。,L4,自然开场 + disaster制造悬念，暗示是个有趣故事。,"[{""en"":""I've been thinking about this question, and one memory that immediately came to mind was..."",""zh"":""我一直在想这个问题，第一时间浮现的是...""}]"
雅思·IELTS Band 8.5 游刃有余,开怀大笑的经历,叙事铺垫,Here's the thing — none of us had any idea what we were doing. We were 22, we had a borrowed car, a half-baked map, and way too much confidence.,关键是没人知道自己在干什么。22岁，借来的车，半成品的路线图，过分的自信。,L4,Here's the thing设悬念 + 具体细节（22, borrowed, half-baked, too much confidence）制造画面感。,"[{""en"":""Here's the thing — none of us had any idea what we were doing."",""zh"":""关键是没人知道自己在干什么。""}]"
雅思·IELTS Band 8.5 游刃有余,开怀大笑的经历,高潮描述,So there we were, in the middle of nowhere, GPS signal gone, and it was starting to rain. And instead of panicking, we just... looked at each other and burst out laughing.,前不着村后不着店，GPS没信号了，天开始下雨。我们没慌张，而是看着对方——然后爆笑。,L4,So there we were情景设定 + instead of... we just...节奏转换 + burst out laughing核心。,"[{""en"":""So there we were, in the middle of nowhere, GPS signal gone..."",""zh"":""前不着村后不着店，GPS没信号了...""}]"
雅思·IELTS Band 8.5 游刃有余,开怀大笑的经历,互动问句,I mean, what else could we do, right? We were completely lost, but somehow that was exactly what we needed.,我们还能怎么办呢，对吧？完全迷路了，但这恰恰是我们需要的。,L4,I mean自然过渡 + right?互动修辞问句 + that was exactly what we needed对失败的正面解读。,"[{""en"":""I mean, what else could we do, right?"",""zh"":""我们还能怎么办呢，对吧？""}]"
雅思·IELTS Band 8.5 游刃有余,开怀大笑的经历,递进强调,And I'm not talking about a little chuckle — I mean the kind of laughing where you can't breathe, where tears are streaming down your face, and every time you think you're about to stop, someone makes a face and you're off again.,不是轻笑——是笑到喘不上气、眼泪直流，每次以为要停了，有人做个鬼脸你又不行了的那种。,L4,I'm not talking about... I mean...递进强调 + 用细节构建画面感 + 节奏感强。,"[{""en"":""And I'm not talking about a little chuckle — I mean the kind of laughing where you can't breathe..."",""zh"":""不是轻笑——是笑到喘不上气的那种...""}]"
雅思·IELTS Band 8.5 游刃有余,开怀大笑的经历,反思升华,I think what made it so special was that it wasn't funny in a traditional sense — it was the absurdity of the situation, and the fact that we were all in it together.,它特别的原因不是传统意义上的好笑——是情景的荒诞感，以及我们共同经历的事实。,L4,从好笑到为什么好笑的自我分析——Band 8.5特有的反思深度。,"[{""en"":""I think what made it so special was that it wasn't funny in a traditional sense..."",""zh"":""它特别的原因不是传统意义上的好笑...""}]"
雅思·IELTS Band 8.5 游刃有余,开怀大笑的经历,总结金句,Looking back, that trip was a mess. But it's also one of my fondest memories — not despite the chaos, but because of it.,回头看，那次旅行一团糟。但它也是我最珍贵的回忆——不是因为尽管混乱，而是正因为那混乱。,L4,not despite... but because of...高级句式 + 对立升华。,"[{""en"":""Looking back, that trip was a mess. But it's also one of my fondest memories — not despite the chaos, but because of it."",""zh"":""回头看，那次旅行一团糟。但它也是我最珍贵的回忆——不是因为尽管混乱，而是正因为那混乱。""}]"
雅思·IELTS Band 8.5 游刃有余,如释重负的时刻,自然开场,The first thing that comes to mind is the moment I submitted my final university dissertation. I remember closing my laptop and just... sitting there for a solid minute, not quite believing it was over.,第一个想到的是提交毕业论文的那一刻。合上电脑，就那么坐了一分钟，不太敢相信结束了。,L4,The first thing that comes to mind自然开场 + just...sitting there停顿节奏 + not quite believing微妙情感。,"[{""en"":""The first thing that comes to mind is the moment I submitted my final university dissertation."",""zh"":""第一个想到的是提交毕业论文的那一刻。""}]"
雅思·IELTS Band 8.5 游刃有余,如释重负的时刻,情感铺垫,I'd been working on this thing for the better part of a year. And I'm not exaggerating — there were nights where I genuinely thought I wasn't going to make it.,这篇论文写了将近一年。不夸张——好几个晚上真的觉得自己完不成了。,L4,the better part of a year地道表达 + I'm not exaggerating强调真实性 + genuinely thought情感深度。,"[{""en"":""I'd been working on this thing for the better part of a year."",""zh"":""这篇论文写了将近一年。""}]"
雅思·IELTS Band 8.5 游刃有余,如释重负的时刻,深入一层,And the thing is, it wasn't just the workload — it was the pressure I put on myself. I had this voice in my head that kept saying 'it's not good enough.',关键不只是工作量——还有我给自己加的压力。脑子里一直有个声音说不够好。,L4,The thing is深入一层 + voice in my head画面感 + 自我反思。,"[{""en"":""And the thing is, it wasn't just the workload — it was the pressure I put on myself."",""zh"":""关键不只是工作量——还有我给自己加的压力。""}]"
雅思·IELTS Band 8.5 游刃有余,如释重负的时刻,情感具象化,So when I finally hit 'submit' and saw that confirmation email, I felt this... this wave of relief wash over me. It was almost physical — like I'd been holding my breath for a year and could finally exhale.,点下提交看到确认邮件时，一股如释重负的浪潮涌来。几乎是身体上的——像憋了一年的气终于可以呼出来。,L4,wave of relief wash over me情感具象化 + almost physical用身体感受描述情感 + 比喻。,"[{""en"":""So when I finally hit 'submit' and saw that confirmation email, I felt this... this wave of relief wash over me."",""zh"":""点下提交看到确认邮件时，一股如释重负的浪潮涌来。""}]"
雅思·IELTS Band 8.5 游刃有余,如释重负的时刻,幽默收尾,And then — I kid you not — I ordered a pizza, watched a terrible movie, and fell asleep on the couch by 8 PM. Best. Night. Ever.,然后——我认真的——我点了个披萨，看了一部烂片，晚上8点在沙发上睡着了。最棒的夜晚！,L4,I kid you not口语感 + Best. Night. Ever.断句节奏制造幽默——Band 8.5特有的调皮。,"[{""en"":""And then — I kid you not — I ordered a pizza, watched a terrible movie, and fell asleep on the couch by 8 PM. Best. Night. Ever."",""zh"":""然后——我认真的——我点了个披萨，看了一部烂片，晚上8点在沙发上睡着了。最棒的夜晚！""}]"
雅思·IELTS Band 8.5 游刃有余,如释重负的时刻,深层升华,I used to think that relief was about escaping something bad. But now I realize that real relief isn't about avoiding pain — it's about releasing the weight you've been carrying, and realizing you were strong enough to carry it all along.,我以前觉得如释重负就是躲过坏事。但现在意识到真正的释然不是避开痛苦——而是放下你一直在扛的重量，并发现你一直都有能力扛住。,L4,I used to think... but now I realize...反思框架 + releasing the weight比喻 + 最终拥抱自己。,"[{""en"":""I used to think that relief was about escaping something bad. But now I realize that real relief isn't about avoiding pain..."",""zh"":""我以前觉得如释重负就是躲过坏事。但现在意识到..."}]"
雅思·IELTS Band 8.5 游刃有余,成功与幸福,开场破题,I mean, that's a deceptively simple question, isn't it? Because the moment you start digging into what 'success' actually means, you realize it's incredibly personal.,这个问题看似简单实则不然，对吧？一旦开始深挖成功的含义，你会发现它极其个人化。,L4,deceptively simple精准搭配 + isn't it?互动问句 + 自然对话感。,"[{""en"":""I mean, that's a deceptively simple question, isn't it?"",""zh"":""这个问题看似简单实则不然，对吧？""}]"
雅思·IELTS Band 8.5 游刃有余,成功与幸福,提出观点,The way I see it, we've been sold this very narrow definition of success — good job, big salary, nice house — and I think a lot of people are chasing that without ever stopping to ask if it's what they actually want.,我们被灌输了一种非常狭隘的成功定义——好工作、高薪、大房子——很多人都在追这个，从没停下来问这是不是他们真正想要的。,L4,The way I see it个人立场 + sold this very narrow definition隐喻 + chasing without stopping批判。,"[{""en"":""The way I see it, we've been sold this very narrow definition of success..."",""zh"":""我们被灌输了一种非常狭隘的成功定义...""}]"
雅思·IELTS Band 8.5 游刃有余,成功与幸福,有趣发现,And here's where it gets interesting — the people I know who seem happiest aren't the ones who 'have it all.' They're the ones who figured out what matters to them and had the courage to prioritize it.,有意思的是——我认识的最快乐的人不是拥有一切的人。而是想清楚什么对自己重要并勇敢优先去做的人。,L4,here's where it gets interesting制造兴趣 + have it all地道 + prioritize it精准。,"[{""en"":""And here's where it gets interesting — the people I know who seem happiest aren't the ones who 'have it all.'"",""zh"":""有意思的是——我认识的最快乐的人不是拥有一切的人。""}]"
雅思·IELTS Band 8.5 游刃有余,成功与幸福,深度推测,I could be wrong, but my sense is that we're in the middle of a pretty fundamental shift in how people think about success — especially younger generations. They're asking different questions, like 'is this meaningful?' rather than just 'does this pay well?',我可能不对，但我的感觉是人们对成功的看法正在经历一个根本性转变——尤其是年轻一代。他们在问这有意义吗？而不是仅仅这赚钱吗？,L4,I could be wrong, but my sense is...谦虚推测 + fundamental shift精准 + especially / rather than just对比。,"[{""en"":""I could be wrong, but my sense is that we're in the middle of a pretty fundamental shift..."",""zh"":""我可能不对，但我的感觉是正在经历一个根本性转变...""}]"
雅思·IELTS Band 8.5 游刃有余,成功与幸福,总结提炼,So I guess what it comes down to is — we need to stop letting society define success for us, and start having the courage to define it for ourselves. Which, I'll admit, is easier said than done.,所以归根结底——我们要停止让社会替我们定义成功，开始有勇气自己定义它。我承认这说起来容易做起来难。,L4,So I guess what it comes down to is...总结句式 + easier said than done地道习语 + 诚实感。,"[{""en"":""So I guess what it comes down to is — we need to stop letting society define success for us..."",""zh"":""所以归根结底——我们要停止让社会替我们定义成功...""}]"
雅思·IELTS Band 8.5 游刃有余,社交媒体与人际关系,现象描述,I think we're all kind of aware that social media has changed the way we relate to each other — but I'm not sure we've fully processed how profound that change actually is.,我们都心知肚明社交媒体改变了我们相处的方式——但我不确定我们是否完全消化了这个变化有多深刻。,L4,kind of / fully processed口语与书面自然混合。,"[{""en"":""I think we're all kind of aware that social media has changed the way we relate to each other..."",""zh"":""我们都心知肚明社交媒体改变了我们相处的方式...""}]"
雅思·IELTS Band 8.5 游刃有余,社交媒体与人际关系,复杂情感,Here's what I find fascinating — and a little unsettling — we've never been more 'connected' in terms of technology, yet rates of loneliness have never been higher. Something about that doesn't add up.,我觉得有意思又有点不安的是——技术上从未如此连接，但孤独感从未如此之高。这有点说不通。,L4,fascinating and a little unsettling复杂情感 + doesn't add up地道表达引出问题。,"[{""en"":""Here's what I find fascinating — and a little unsettling — we've never been more 'connected'..."",""zh"":""我觉得有意思又有点不安的是——技术上从未如此连接...""}]"
雅思·IELTS Band 8.5 游刃有余,社交媒体与人际关系,核心分析,I don't think the problem is social media itself — it's more about how we use it. There's a big difference between scrolling through someone's curated highlight reel and actually having a real conversation with them.,问题不是社交媒体本身——更多是我们怎么用它。刷别人精心包装的精彩片段和真正聊天，差很多。,L4,curated highlight reel精准比喻 + scolling through / actually having a real conversation主动vs被动对比。,"[{""en"":""I don't think the problem is social media itself — it's more about how we use it."",""zh"":""问题不是社交媒体本身——更多是我们怎么用它。""}]"
雅思·IELTS Band 8.5 游刃有余,社交媒体与人际关系,修辞问句,I mean, think about it — when was the last time you called a friend just to talk, versus the last time you liked their post? And which one actually made you feel connected?,你想想——你最后一次打电话给朋友只为聊天是什么时候，对比点赞是什么时候？哪个真正让你感到连接？,L4,think about it互动邀请 + 修辞问句引导思考 + 对比强烈。,"[{""en"":""I mean, think about it — when was the last time you called a friend just to talk..."",""zh"":""你想想——你最后一次打电话给朋友只为聊天是什么时候...""}]"
雅思·IELTS Band 8.5 游刃有余,社交媒体与人际关系,重新定义问题,So I guess the question isn't whether social media is good or bad — it's whether we're using it intentionally, or letting it use us. And I think that's a question worth sitting with.,所以问题不是社交媒体好还是坏——而是我们有意识地在用，还是让它用我们。这是一个值得好好思考的问题。,L4,So I guess the question isn't... it's...重新定义问题框架 + worth sitting with地道表达。,"[{""en"":""So I guess the question isn't whether social media is good or bad — it's whether we're using it intentionally, or letting it use us."",""zh"":""所以问题不是社交媒体好还是坏——而是我们有意识地在用，还是让它用我们。""}]"
雅思·IELTS Band 8.5 游刃有余,代际差异,幽默开场,It's funny, because I used to roll my eyes at the whole 'young people these days' narrative. But now that I'm a bit older, I catch myself doing the same thing — and it's humbling.,有趣的是我以前对现在的年轻人这种说法翻白眼。但现在年纪大了一点，发现自己也这样——这挺让人谦卑的。,L4,It's funny, because...幽默开场 + roll my eyes口语 + humbling自我反思。,"[{""en"":""It's funny, because I used to roll my eyes at the whole 'young people these days' narrative."",""zh"":""有趣的是我以前对现在的年轻人这种说法翻白眼。""}]"
雅思·IELTS Band 8.5 游刃有余,代际差异,普遍倾向,I think every generation has this tendency to think they're the ones who 'get it' and the next generation doesn't. But what actually changes is the context — the world they're growing up in is fundamentally different.,每代人都有点觉得自己懂，下一代不懂。但真正变的是环境——他们成长的世界已经完全不同了。,L4,tendency指出普遍倾向 + fundamentally different核心论点。,"[{""en"":""I think every generation has this tendency to think they're the ones who 'get it'..."",""zh"":""每代人都有点觉得自己懂，下一代不懂。""}]"
雅思·IELTS Band 8.5 游刃有余,代际差异,真诚赞赏,What I find genuinely impressive about younger generations — and I don't say this to flatter them — is their emotional intelligence. They're having conversations about mental health, identity, consent, boundaries.,我真心觉得年轻一代了不起的是——我不是为了夸他们——是他们的情商。他们在聊心理健康、身份认同、同意、边界。,L4,What I find genuinely impressive... is...精准聚焦 + I don't say this to flatter them诚实感 + 具体例子。,"[{""en"":""What I find genuinely impressive about younger generations — and I don't say this to flatter them — is their emotional intelligence."",""zh"":""我真心觉得年轻一代了不起的是他们的情商。""}]"
雅思·IELTS Band 8.5 游刃有余,代际差异,平衡观点,That said, I think older generations have something valuable too — perspective. When you've been through a few ups and downs, you start to realize that most things aren't as urgent or as catastrophic as they first seem.,话虽如此，老一辈也有宝贵的东西——视角。当经历过几次起落后，会意识到大多数事情没有最初看起来那么紧急或灾难性。,L4,That said平衡转折 + ups and downs地道习语 + wisdom。,"[{""en"":""That said, I think older generations have something valuable too — perspective."",""zh"":""话虽如此，老一辈也有宝贵的东西——视角。""}]"
雅思·IELTS Band 8.5 游刃有余,代际差异,升华总结,I don't know if this is just me, but I feel like the real potential lies in bridging these perspectives — combining the idealism and awareness of younger people with the wisdom and patience of older generations. That's where the magic happens.,不知道是不是只有我这么觉得，但真正的潜力在于连接这两种视角——把年轻人的理想主义和觉知与老一辈的智慧和耐心结合起来。这才是魔法发生的地方。,L4,I don't know if this is just me, but...谦虚开场 + bridging these perspectives核心论点 + the magic happens口语总结。,"[{""en"":""I don't know if this is just me, but I feel like the real potential lies in bridging these perspectives..."",""zh"":""不知道是不是只有我这么觉得，但真正的潜力在于连接这两种视角...""}]"
雅思·IELTS Band 8.5 游刃有余,信息与智慧,开场破题,Oh, this is one of those questions that sounds simple but isn't. Because on the surface, having more information should make us wiser — but I think we're living proof that it doesn't work that way.,这是个听着简单其实不然的问题。表面上看信息越多应该让我们越有智慧——但我觉得我们就是活生生的反例。,L4,living proof地道习语 + 观点鲜明。,"[{""en"":""Oh, this is one of those questions that sounds simple but isn't."",""zh"":""这是个听着简单其实不然的问题。""}]"
雅思·IELTS Band 8.5 游刃有余,信息与智慧,提出问题,I mean, think about it — we have access to more information than any generation in history, yet we seem more divided, more confused, and more susceptible to misinformation than ever. Something's clearly not working.,我们能获取的信息比历史上任何一代都多，但也更分裂、更困惑、更容易被误导。这显然有问题。,L4,think about it邀请思考 + susceptible to misinformation精准词汇 + Something's clearly not working自然结论。,"[{""en"":""I mean, think about it — we have access to more information than any generation in history..."",""zh"":""我们能获取的信息比历史上任何一代都多...""}]"
雅思·IELTS Band 8.5 游刃有余,信息与智慧,三层区分,I think the problem is that we're confusing information with knowledge, and knowledge with wisdom. They're not the same thing. Information is just raw data. Knowledge is information you've processed. Wisdom is knowing what to do with it — and more importantly, knowing what to ignore.,问题是我们把信息、知识和智慧混为一谈。信息是原始数据。知识是加工过的信息。智慧是知道怎么用它——更重要的，知道忽略什么。,L4,三层递进区分（information→knowledge→wisdom）+ knowing what to ignore反直觉观点。,"[{""en"":""I think the problem is that we're confusing information with knowledge, and knowledge with wisdom."",""zh"":""问题是我们把信息、知识和智慧混为一谈。""}]"
雅思·IELTS Band 8.5 游刃有余,信息与智慧,现代智慧,And here's the thing — there's a huge difference between being well-informed and being overwhelmed. I think a wise person in the 21st century isn't the one who knows the most — it's the one who's best at filtering out noise.,关键是被充分告知和被信息淹没有很大区别。21世纪最有智慧的人不是知道最多的——而是最擅长过滤噪音的。,L4,well-informed vs overwhelmed对比 + filtering out noise现代智慧。,"[{""en"":""And here's the thing — there's a huge difference between being well-informed and being overwhelmed."",""zh"":""关键是被充分告知和被信息淹没有很大区别。""}]"
雅思·IELTS Band 8.5 游刃有余,信息与智慧,核心技能,So I guess the skill we really need to teach isn't how to find information — that's the easy part. It's how to evaluate it, how to question its sources, and how to sit with uncertainty when there are no clear answers.,真正需要教的技能不是怎么找信息——那是最容易的——而是怎么评估它、质疑它的来源、以及在没有明确答案时如何与不确定性相处。,L4,the easy part口语对比 + sit with uncertainty地道表达 + 深刻洞见。,"[{""en"":""So I guess the skill we really need to teach isn't how to find information — that's the easy part."",""zh"":""真正需要教的技能不是怎么找信息——那是最容易的。""}]"
雅思·IELTS Band 8.5 游刃有余,竞争与合作,挑战假设,I think we've been raised on this idea that competition is what drives progress — 'survival of the fittest' and all that. But the more I learn about evolution and human history, the more I realize how much of our success actually comes from cooperation.,我们从小被灌输竞争推动进步——适者生存之类的。但我越了解进化和人类历史，越意识到我们的成功很多来自合作。,L4,raised on this idea地道 + survival of the fittest and all that口语引用 + the more I... the more I realize...递进。,"[{""en"":""I think we've been raised on this idea that competition is what drives progress..."",""zh"":""我们从小被灌输竞争推动进步...""}]"
雅思·IELTS Band 8.5 游刃有余,竞争与合作,现实对比,It's funny, because in school, we're constantly ranked and compared. You learn that winning is everything. But then you enter the real world and you realize that the most successful people aren't the ones who beat everyone else — they're the ones who know how to build teams, collaborate, and bring out the best in others.,在学校里不断被排名比较。你学会赢是一切。但进了现实世界才发现，最成功的人不是打败所有人的——而是知道怎么建团队、协作、激发别人潜力的人。,L4,It's funny, because...幽默对比 + bring out the best in others地道搭配。,"[{""en"":""It's funny, because in school, we're constantly ranked and compared."",""zh"":""在学校里不断被排名比较。""}]"
雅思·IELTS Band 8.5 游刃有余,竞争与合作,平衡观点,I'm not saying competition is bad — I think it can push us to achieve things we wouldn't on our own. But I think the optimal balance is competition with a foundation of cooperation — like in sports, where you compete fiercely but shake hands at the end.,我不是说竞争不好——它能推动我们实现独自完成不了的事。但最优平衡是在合作基础上的竞争——就像体育，激烈竞争但赛后握手。,L4,I'm not saying... I think...平衡立场 + optimal balance精准 + like in sports生动类比。,"[{""en"":""I'm not saying competition is bad — I think it can push us to achieve things we wouldn't on our own."",""zh"":""我不是说竞争不好——它能推动我们实现独自完成不了的事。""}]"
雅思·IELTS Band 8.5 游刃有余,竞争与合作,总结提炼,So I guess what it comes down to is — the question isn't which one is better. It's how we combine them. And I'd argue that the cultures and organizations that do that well are the ones that truly thrive.,所以归根结底——问题不是哪个更好。而是怎么结合它们。我认为能把这件事做好的文化和组织才是真正繁荣的。,L4,So I guess what it comes down to is...总结句式 + I'd argue that...自信表达 + truly thrive升华。,"[{""en"":""So I guess what it comes down to is — the question isn't which one is better. It's how we combine them."",""zh"":""所以归根结底——问题不是哪个更好。而是怎么结合它们。""}]"
